{
  "schema_version": "1.0.0",
  "candidate_id": "CAND-0042",
  "revision": 1,
  "created_at": "2026-10-01T13:00:00Z",
  "data_scope": "example-scope",
  "source_observations": [
    {
      "capture_id": "ea1b45a774f5215c453ac1622808d9800f81085dc5f44e5ecd6008229d1bef14",
      "observation_id": "OBS-ea1b45a774f5215c453ac1622808d9800f81085dc5f44e5ecd6008229d1bef14-001",
      "source_agent_repository_id": "10001",
      "capture_path": "captures/10001/session-example-01/ea1b45a774f5215c453ac1622808d9800f81085dc5f44e5ecd6008229d1bef14.json"
    }
  ],
  "hypothesis": "Checking approved context before clarification reduces redundant questions without suppressing necessary questions.",
  "proposed_mechanism": "Add a bounded context-check procedure before requirements clarification.",
  "applies_when": "An agent is about to ask for information that may already be confirmed in its authorized workspace.",
  "does_not_apply_when": "Information is missing, contradictory, outdated, or explicitly requires reconfirmation.",
  "expected_benefit": "Fewer requests for already-confirmed information.",
  "risks": [
    "Necessary clarification could be suppressed.",
    "Retrieval could add latency or consult stale context."
  ],
  "contradicting_observation_ids": [],
  "scope": "shared",
  "target": {
    "repository_id": "10002",
    "repository_full_name": "example-org/sdlc-dev-kit",
    "base_branch": "main",
    "base_commit": "3333333333333333333333333333333333333333",
    "ownership_rationale": "Illustrative only: this target assumes code inspection establishes that the shared kit owns the relevant context-check behavior.",
    "proposed_paths": [
      "skills/requirements-context-check/SKILL.md"
    ]
  },
  "registry_revision": "example-registry-v1",
  "policy_revision": "example-policy-v1",
  "evaluation_plan": {
    "development_cases": [
      "Confirmed information is reused instead of requested again."
    ],
    "negative_cases": [
      "Missing information still triggers clarification.",
      "Contradictory information triggers clarification.",
      "Unauthorized workspace context is never retrieved."
    ],
    "mandatory_invariants": [
      "Approval requirements are unchanged.",
      "Workspace data isolation is preserved."
    ],
    "affected_consumers": [
      "requirements-primary",
      "design-architecture"
    ],
    "acceptance_criteria_ref": "example-policy:clarification-suite:v1",
    "budget_ref": "example-policy:manual-dream-run-budget:v1"
  },
  "supersedes_revision": null
}
